{
  "schema_version": "1.0.0",
  "run_id": "demo-run",
  "attempt_id": "attempt-01",
  "manifest_sha256": "0000000000000000000000000000000000000000000000000000000000000000",
  "ledger_sha256": "0000000000000000000000000000000000000000000000000000000000000000",
  "sealed_paths_sha256": "0000000000000000000000000000000000000000000000000000000000000000",
  "sealed_at": "2026-06-23T01:00:00Z",
  "sealer": {
    "name": "keelplane-capture",
    "version": "0.1.0",
    "origin": "local-observed"
  },
  "signature": null,
  "assurance": "A1-local-observed"
}
